{
  "$schema": "https://json-schema.org/draft/2020-12/schema",
  "$id": "https://kais.shot-timeline/spec/schemas/asset.schema.json",
  "draft": "2020-12",
  "title": "ShotTimelineAsset manifest (asset.json)",
  "description": "Self-describing manifest for a ShotTimelineAsset — a portable, multi-track shot decomposition produced by kais-shot-timeline and consumed by downstream canvases (e.g. @kais/infinite-canvas). The manifest carries the schema_version, source provenance, generator identity, the inventory of 5 canonical data JSON files, and the inventory of canonical media files (video + 3 stems). Producer (Phase 2): exporter writing asset.json into the asset directory. Consumer: any reader that wants to understand the asset without external docs.",
  "$comment": "Graceful-degrade rule (SPEC-02 / CONTEXT D-02): The schema is intentionally strict (additionalProperties: false on every object). Strictness at validation time is what forces explicit version bumps. The CONSUMER, however, must be lenient at RUNTIME: on an unknown or newer schema_version, ignore unknown fields, render the known parts, and emit a warning — do NOT reject or crash. New field = minor version bump (old consumers degrade gracefully). Breaking change (rename, semantic shift, removal) = major bump, and MUST be documented in the prose SPEC migration section. Semver-lite: major[.minor], e.g. \"1\" or \"1.1\" — NOT full semver (no patch component, no pre-release tags).",
  "type": "object",
  "additionalProperties": false,
  "required": ["schema_version", "asset_type", "source", "generator", "data", "media"],
  "properties": {
    "schema_version": {
      "type": "string",
      "pattern": "^(0|[1-9]\\d*)(\\.(0|[1-9]\\d*))?$",
      "description": "Asset contract version, semver-lite (major[.minor]). Examples: \"1\", \"1.1\", \"2.0\". Non-examples: \"v1\", \"1.1.1\", \"\". Consumer MUST graceful-degrade on unknown/newer versions: ignore unknown fields, render known parts, emit a warning — do NOT reject. New field = minor bump; breaking change (rename/semantic shift/removal) = major bump (document migration in SPEC.md)."
    },
    "asset_type": {
      "const": "shottimeline",
      "description": "Asset kind discriminator. Always the literal \"shottimeline\" for this contract — lets a future reader distinguish this asset kind from others sharing a directory."
    },
    "source": {
      "type": "object",
      "additionalProperties": false,
      "required": ["video_filename", "duration_sec"],
      "description": "Provenance of the original source video.",
      "properties": {
        "video_filename": {
          "type": "string",
          "description": "Original source video filename (basename, e.g. \"《小江湖》第03话：….mp4\")."
        },
        "duration_sec": {
          "type": "number",
          "minimum": 0,
          "description": "Source video duration in seconds (from ffprobe)."
        }
      }
    },
    "generator": {
      "type": "object",
      "additionalProperties": false,
      "required": ["tool", "version", "generated_at"],
      "description": "Identity of the tool that produced this asset.",
      "properties": {
        "tool": {
          "type": "string",
          "description": "Tool name (e.g. \"kais-shot-timeline\")."
        },
        "version": {
          "type": "string",
          "description": "Tool version (any string — semver, git SHA, build id)."
        },
        "generated_at": {
          "type": "string",
          "description": "ISO-8601 datetime (UTC recommended, e.g. \"2026-07-20T00:00:00Z\")."
        },
        "warnings": {
          "type": "array",
          "items": { "type": "string" },
          "description": "v1.1 additive (OPTIONAL — Phase 6). Non-fatal warnings encountered during asset generation (e.g. cinematography route unreachable → empty prompts facets). Older assets omit it and still validate (graceful-degrade). Producer emits the field only when the list is non-empty; absent on clean runs. Operator-facing failure reasons only (exception class + message, route status codes) — no PII, no auth tokens, no body payloads."
        },
        "registry_snapshot": {
          "type": "object",
          "additionalProperties": false,
          "required": ["characters", "props"],
          "description": "v1.1 additive (OPTIONAL — Phase 8). generator.registry_snapshot is a frozen-at-export-time compact view of confirmed registry entries (characters + props). Embeds id/name/representative_image/appearance_shots per entry — enough for a consumer to resolve prompts.character_refs[]/prop_refs[] and render a gallery WITHOUT re-reading external characters.json/props.json. The registry_snapshot is the export-time truth: later registry mutations (re-review, re-cluster, rename) cannot invalidate already-exported prompt references (Pitfall 18 prevented). Older assets omit registry_snapshot and still validate (graceful-degrade). Producer emits registry_snapshot only when characters.json or props.json exists at export time; absent on assets produced without re-id (v1.0 byte-identical).",
          "properties": {
            "characters": {
              "type": "array",
              "description": "Character entries in registry_snapshot — confirmed-only (review_state=='confirmed') projection of characters.json at export time. Compact 4-field shape (id/name/representative_image/appearance_shots); omits looks[].",
              "items": {
                "type": "object",
                "additionalProperties": false,
                "required": ["id", "name", "appearance_shots"],
                "properties": {
                  "id": { "type": "string", "pattern": "^char_[0-9]{3}$" },
                  "name": { "type": "string", "minLength": 1 },
                  "representative_image": {
                    "type": "string",
                    "pattern": "^(?!.*\\.\\.)([^/]+/)*characters/[^:*?\"<>|]+\\.png$"
                  },
                  "appearance_shots": {
                    "type": "array",
                    "items": { "type": "integer", "minimum": 1 }
                  }
                }
              }
            },
            "props": {
              "type": "array",
              "description": "Prop entries in registry_snapshot — confirmed-only projection of props.json at export time. Same compact 4-field shape as characters; omits states[].",
              "items": {
                "type": "object",
                "additionalProperties": false,
                "required": ["id", "name", "appearance_shots"],
                "properties": {
                  "id": { "type": "string", "pattern": "^prop_[0-9]{3}$" },
                  "name": { "type": "string", "minLength": 1 },
                  "representative_image": {
                    "type": "string",
                    "pattern": "^(?!.*\\.\\.)([^/]+/)*props/[^:*?\"<>|]+\\.png$"
                  },
                  "appearance_shots": {
                    "type": "array",
                    "items": { "type": "integer", "minimum": 1 }
                  }
                }
              }
            }
          }
        }
      }
    },
    "data": {
      "type": "object",
      "additionalProperties": false,
      "required": ["shots", "audio_analysis", "transcript", "frames", "prompts"],
      "description": "Inventory of the 5 canonical data JSON files. Each value is a path relative to the asset root.",
      "properties": {
        "shots": {
          "type": "string",
          "pattern": "^(?!.*\\.\\.)[^:*?\"<>|]+\\.json$",
          "description": "Relative path to shots.json (no parent traversal, no drive letters, must end in .json)."
        },
        "audio_analysis": {
          "type": "string",
          "pattern": "^(?!.*\\.\\.)[^:*?\"<>|]+\\.json$",
          "description": "Relative path to audio_analysis.json."
        },
        "transcript": {
          "type": "string",
          "pattern": "^(?!.*\\.\\.)[^:*?\"<>|]+\\.json$",
          "description": "Relative path to transcript.json."
        },
        "frames": {
          "type": "string",
          "pattern": "^(?!.*\\.\\.)[^:*?\"<>|]+\\.json$",
          "description": "Relative path to frames.json."
        },
        "prompts": {
          "type": "string",
          "pattern": "^(?!.*\\.\\.)[^:*?\"<>|]+\\.json$",
          "description": "Relative path to prompts.json."
        },
        "characters": {
          "type": "string",
          "pattern": "^(?!.*\\.\\.)[^:*?\"<>|]+\\.json$",
          "description": "v1.1 additive (OPTIONAL — absent on v1 assets). Relative path to characters.json (the canonical confirmed character registry produced by Phase 7 HITL apply_edits). Emitted only when re-id ran and review confirmed entries; older assets omit it and still validate (graceful-degrade)."
        },
        "props": {
          "type": "string",
          "pattern": "^(?!.*\\.\\.)[^:*?\"<>|]+\\.json$",
          "description": "v1.1 additive (OPTIONAL — absent on v1 assets). Relative path to props.json (canonical confirmed prop registry). Same emission rule as characters."
        },
        "audio_semantic": {
          "type": "string",
          "pattern": "^(?!.*\\.\\.)[^:*?\"<>|]+\\.json$",
          "description": "v1.2 additive (OPTIONAL — 缺席 on v1.0/v1.1 assets). Relative path to audio_semantic.json (per-shot 三模态 dialogue/sfx + reproduction prompts produced by Phase 15). Emitted only when route-host round-trip succeeded AND the file exists on disk; older assets omit it and still validate (graceful-degrade, CONTRACT-05)."
        },
        "speakers": {
          "type": "string",
          "pattern": "^(?!.*\\.\\.)[^:*?\"<>|]+\\.json$",
          "description": "v1.2 additive (OPTIONAL — 缺席 on v1.0/v1.1 assets). Relative path to speakers.json (canonical confirmed speaker registry produced by Phase 13 HITL link_speakers). Same emission rule as characters/props — file exists on disk → emit; absent → OMIT (byte-identical to v1.0/v1.1 producer output)."
        }
      }
    },
    "media": {
      "type": "object",
      "additionalProperties": false,
      "required": ["video", "stems"],
      "description": "Inventory of canonical media files. Paths are relative to the asset root and MUST follow the canonical naming (CONTEXT D-03): video.mp4 at root or one directory deep; stems under stems/{vocals,drums,other}.wav. The producer's pre-canonical layout (stems/htdemucs/<stem>/{vocals,drums,bass,other}.wav) is NOT accepted here — the Phase 2 exporter renames to canonical before writing asset.json. bass.wav is intentionally excluded (consumer frontend only uses 3 stems).",
      "properties": {
        "video": {
          "type": "string",
          "pattern": "^(?!.*\\.\\.)([^/]+/)*video\\.mp4$",
          "description": "Relative path to the canonical video file. Must end in video.mp4 (optionally under one or more directory segments). Rejects ../video.mp4, /abs/video.mp4, video.avi."
        },
        "stems": {
          "type": "object",
          "additionalProperties": false,
          "required": ["vocals", "drums", "other"],
          "description": "Canonical 3-stem WAV inventory (bass is excluded — consumer only renders vocals/drums/other).",
          "properties": {
            "vocals": {
              "type": "string",
              "pattern": "^(?!.*\\.\\.)([^/]+/)*stems/(vocals)\\.wav$",
              "description": "Relative path to vocals WAV. Canonical: stems/vocals.wav."
            },
            "drums": {
              "type": "string",
              "pattern": "^(?!.*\\.\\.)([^/]+/)*stems/(drums)\\.wav$",
              "description": "Relative path to drums WAV. Canonical: stems/drums.wav."
            },
            "other": {
              "type": "string",
              "pattern": "^(?!.*\\.\\.)([^/]+/)*stems/(other)\\.wav$",
              "description": "Relative path to other WAV. Canonical: stems/other.wav."
            }
          }
        },
        "characters": {
          "type": "array",
          "items": {
            "type": "string",
            "pattern": "^(?!.*\\.\\.)([^/]+/)*characters/[^:*?\"<>|]+\\.png$"
          },
          "description": "v1.1 additive (OPTIONAL — absent on v1 assets). External character portrait PNGs as relative paths (NOT base64 — prevents 10-50x asset bloat). Anti-traversal enforced (rejects ../, absolute paths, Windows reserved chars). Canonical naming: characters/<id>.png. Served via Range-aware HTTP (serve.py), same as video/stems."
        },
        "props": {
          "type": "array",
          "items": {
            "type": "string",
            "pattern": "^(?!.*\\.\\.)([^/]+/)*props/[^:*?\"<>|]+\\.png$"
          },
          "description": "v1.1 additive (OPTIONAL — absent on v1 assets). External prop PNGs as relative paths (NOT base64). Anti-traversal enforced. Canonical: props/<id>.png."
        }
      }
    }
  }
}
