{
  "schema_version": "1",
  "asset_type": "shottimeline",
  "source": {
    "video_filename": "sample.mp4",
    "duration_sec": 3.0
  },
  "generator": {
    "tool": "kais-shot-timeline",
    "version": "0.1.0-spec-fixture",
    "generated_at": "2026-07-20T00:00:00Z"
  },
  "data": {
    "shots": "shots.json",
    "audio_analysis": "audio_analysis.json",
    "transcript": "transcript.json",
    "frames": "frames.json",
    "prompts": "prompts.json"
  },
  "media": {
    "video": "video.mp4",
    "stems": {
      "vocals": "stems/vocals.wav",
      "drums": "stems/drums.wav",
      "other": "stems/other.wav"
    }
  }
}
